,url,title,body
19,https://www.cnn.com/2020/11/18/business/boeing-737-max-approval/index.html,Boeing's 737 Max gets approval to fly passengers again,"The plane, the best-selling jet in Boeing's (BA) fleet, was grounded in March 2019 after two fatal crashes that killed 346 people. It was discovered that a safety feature meant to stop the plane from climbing too fast and stalling had improperly forced the nose of the plane down, causing the crashes. The process of approving the plane to carry passengers has stretched on far longer than originally expected and cost Boeing more than $20 billion, according to the company. Lost orders for the jet during that time could make it among the most expensive mistakes ever made by a company. Although approval was expected this week, Boeing (BA) shares rose in morning trading, but then closed lower, along with broader markets, on concerns a rise in Covid-19 cases. The first step The FAA action is only the first step in allowing 59 airlines -- spread across 32 countries -- to once again fly the 387 grounded planes as part of their schedules. The FAA orders cover only US domestic flights for the 737 Max jets operated by American, United and Southwest Airlines, 72 in total. Flights to or within other countries will need the approval of those nations' aviation authorities. And as for the US, the FAA noted in statement that before any of the planes can be flown with passengers again, the necessary changes to the 737 Max identified in the approval process must be installed and the FAA must inspect the individual planes. The pilots must also complete additional training.  That process is expected to take between a few weeks and a few months, depending on the airline. So far only American Airlines (AAL) has added the plane to its schedule for a handful of flights between Miami and New York in late December and early January.  Other airlines are holding off. Southwest (LUV), which has 34 of the jets -- more than any other airline -- isn't expected to fly passengers on the 737 Max until spring 2021. United (UAL) said it expects to start flying the planes in the first three months of 2021. Weakness in demand What's not yet clear is whether passengers will try to avoid flying  on a 737 Max once those flights resume. US airlines are no longer charging change fees to passengers who shift their travel plans, so fliers who want to book away from a 737 Max flight can do so without penalty.  ""If a customer doesn't want to fly on the 737 Max, they won't have to,"" said a letter from American Airline executives to the carrier's employees on Wednesday. But Travel Fairness Now, a consumer group, said Thursday it believes passengers should be able to get refunds on their tickets instead of a credit if they don't want to fly on a 737 Max jet, and then book on another flight to the same destination without paying any difference in fares. ""The circumstances surrounding the Boeing 737 Max are unprecedented in the history of commercial travel and call for extraordinary protections for understandably concerned consumers,"" said Kurt Ebenhoch, executive director of Travel Fairness Now. One thing that could slow the resumption of 737 Max flights is the extraordinary drop in air traffic demand due to the combination of the Covid-19 pandemic and the global recession it caused.  There are about 1,500 single aisle passenger jets parked by airlines around the world, according to Ascend by Cirium, a research firm that tracks plane usage -- and that number does not include grounded 737 Max jets. Rather, it represents more than 25% of the single aisle planes worldwide since the pandemic broke out.  Even if there is no need to increase the number of planes they fly, airlines still want to start using their 737 Max jets to replace older jets in their fleets, because the Max is about 15% more fuel efficient than the older planes, said Rob Morris, global head of consultancy at Cirium. ""Even though fuel prices are low today ... that fuel saving could still account for something like $750-$1,000 per aircraft per day,"" he said. ""In today's environment where airlines want to preserve as much cash as possible [those savings are] very welcome."" Family members of victims speak out Some of the family members of those who died in the crashes have objected to the Max's return to service. They say Boeing made mistakes in its design, the newest version of a long-serving plane, which made their version dangerous, and that the FAA erred in approving the original version and recertifying it to fly now. ""The plane is inherently unstable and it is unairworthy without its software,"" said Michael Stumo, whose daughter Samaya Rose Stumo died in the March 2019 crash of an Ethiopian Airlines plane. ""They haven't fixed it so far. The flying public should avoid the Max in the future. Change your flight."" Stumo and other family members held a press conference Tuesday ahead of the announcement. Stumo said the FAA should have insisted that a third sensor be added to determine if the plane is in danger of stalling. He said other changes should have been made to the way pilots are alerted if there is a problem. ""We as family members want to avoid a third crash,"" he said.  The Air Line Pilots Association, the union representing pilots at many US airlines including  United, said that while it continues to evaluate the specific crew training rules for the plane's return to service, ""ALPA believes that the engineering fixes to the flight-critical aircraft systems are sound and will be an effective component that leads to the safe return to service of the 737 Max."" Pilots unions at Southwest and American did not have an immediate comment on the FAA's action. The investigation into how to fix the plane was originally expected to be finished by the fall of 2019, but stretched on as new questions about the plane arose. FAA and Boeing praise the process ""The path that led us to this point was long and grueling,"" said FAA Administrator Steve Dickson in a video statement Wednesday. ""But we said from the start that we would take the time necessary to get this right. We were never driven by a timeline, but rather following a methodical and deliberate safety process. During this time FAA employees diligently worked on the fixes that were necessary."" As part of the review process Dickson flew the plane himself in September, and went through the training pilots will have to complete. ""Based on all the activities we have undertaken during the past 20 months, and my personal experience flying the aircraft, I can tell you now I am 100% comfortable with my family flying on it,"" he said. The FAA has worked throughout the process with aviation authorities around the world, and most are expected to issue their own orders to unground the plane as well. But there could be delays in returning the jet  to service around the world. The European Union Aviation Safety Agency, which oversees flights in Europe, said Wednesday it expects to take action in late December or early 2021.  And regulator Transport Canada said it expects to conclude its review ""very soon,"" although it added, ""there will be differences between what the FAA has approved today, and what Canada will require for its operators."" Boeing also said it is confident that the plane will be safe to fly once all the required steps are taken. ""We will never forget the lives lost in the two tragic accidents that led to the decision to suspend operations,"" said David Calhoun, chief executive officer of The Boeing Company. ""These events and the lessons we have learned as a result have reshaped our company and further focused our attention on our core values of safety, quality and integrity."" Problems throughout the inspection In addition to coming up with a software update to the faulty safety system, problems with the safety of the plane's wiring were discovered. There were also questions about the lack of training for pilots who were moving from the original 737 to the 737 Max, which had been a selling point for the plane. The investigation also revealed that many Boeing employees were privately expressing doubts about the planes during the original approval process.  ""Would you put your family on a Max simulator trained aircraft? I wouldn't,"" wrote one employee to another in an internal communication revealed during the investigation. Another employee described the plane as ""designed by clowns, who in turn are supervised by monkeys."" And one wrote simply: ""piss poor design."" -- CNN's Pete Muntean, Gregory Wallace and Hanna Ziady contributed to this report Correction: Southwest Airlines pilots are represented by the Southwest Airlines Pilots Association. An earlier version of this story incorrectly said they were represented by the Air Line Pilots Association."
20,https://www.cnn.com/2020/11/18/investing/masa-son-softbank-cash-hnk-intl/index.html,SoftBank billionaire Masa Son is stockpiling cash for a 'worst-case scenario' ,"While effective vaccines and Covid-19 treatments could soon be coming, the SoftBank CEO said he is pessimistic about second and third wave outbreaks currently playing out around the world.  ""In the next two [to] three months, any disaster could happen,"" Son said on Tuesday, speaking from Tokyo at The New York Times' Dealbook Conference held online this year.  SoftBank announced a fire sale of assets earlier this year to shore up its balance sheet as the pandemic roiled global economies and sent the value of its tech-focused Vision Fund plunging. The initial plan was to sell $41 billion worth of assets, but Son said SoftBank ended up doubling that target. ""It's the first time in our history to liquidate many of the assets as quickly as possible,"" he said.  Before mass distribution of coronavirus treatments or a vaccine become available, ""some major company could crash"" and cause a ""domino effect"" in related industries, he said, using the collapse of Lehman Brothers to illustrate his point.    The fall of just one bank shook the entire banking industry and sparked a global stock market crash, he said.  ""I still want to be prepared for the worst-case scenario, so that's why today we have now almost $80 billion cash in hand ourselves,"" Son said.    Some of that stockpile has already been used to buy back shares in SoftBank, which Son has repeatedly lamented are undervalued by investors.  The tech tycoon is also investing in established tech companies, a move he insisted is consistent with his long-term strategy of betting on the coming artificial intelligence revolution.   Companies like Google (GOOGL), Amazon (AMZN), Facebook (FB) and Apple (AAPL), he said, are key players in the development of AI.  ""Unicorn, public or private, [it] doesn't matter. I just want to bet for the AI revolution,"" Son said.   Some of the bets have already gone sour. SoftBank last week reported losses of 131.7 billion yen ($1.3 billion) ""from investment in listed stocks and other instruments"" for the six months ended in September. During an earnings presentation, Son described his company's latest strategy of investing in highly liquid, blue chip companies and derivative products as ""a pilot program."" The SoftBank founder is best known for plowing huge amounts of money into private tech startups, a strategy that has over the years reaped both huge rewards and public embarrassment.  Son's most famous investment was $20 million in Alibaba (BABA) 20 years ago — a bet that was worth $60 billion when the Chinese e-commerce company went public in 2014. More recently, he has been dogged by a disastrous investment in WeWork that ended with SoftBank having to bail out the office space startup with a costly rescue package. ""We made a lot of loss in the investment in WeWork, billions of dollars. And that is my mistake,"" Son said.  ""But luckily, we have some other hit [investments]. So in total score, we are still positive,"" he said, adding that he remains hopeful that the Vision Fund will make Softbank even more money. The massive tech investment vehicle backed by Saudi Arabia booked gains of 141.4 billion yen ($1.4 billion) for the six months that ended in September after it sold shares in four companies and cashed out of six others, SoftBank said in a filing last week. The filing did not disclose which companies the fund exited."
21,https://www.cnn.com/2020/11/18/success/volkswagen-spin-off-lamborghini-ducati-italdesign/index.html,Volkswagen says it might spin off Lamborghini and Ducati,"The potential spinoff would also include the motorcycle manufacturer Ducati and Italdesign Giugiaro, a design and engineering consulting company. VW CEO Herbert Diess indicated during a conference call with analysts Monday that the company has been working to restructure the three Italian brands with an eye toward forming them into a separate business.  This doesn't necessarily mean that will happen, though, he said. ""We are bringing it into a legal structure where we could act, but it's not yet decided,"" he said. VW could follow in the footsteps of Fiat Chrysler Automobiles (FCAU), which spun off Ferrari (RACE) in 2016 as a separate company with its own stock listing. Exor, a company controlled by the Agnelli family, descendents of Fiat founder Giovanni Agnelli, owns a large share of FCA and a similarly large share of Ferrari. Lamborghini's current CEO, Stefano Domenicali, announced earlier this year that he would be leaving the company to take a new job as CEO of Formula 1 racing. On Wednesday, Volkswagen announced that Stephan Winkelmann will return as CEO and President for Lamborghini, a position he last held from 2005 to 2016. He will also retain his current role as President of Bugatti, which is also owned by VW Group.  Volkswagen has also reportedly been considering selling or trading off the Bugatti brand. Neither VW Group or Bugatti would confirm those reports when asked recently Lamborghini is owned by Volkswagen Group's luxury car subsidiary Audi. Lamborghini, in turn, owns both Italdesign and Ducati. Lamborghini's global sales, while tiny by ordinary auto industry standards, have nearly doubled in recent years thanks to the introduction of the Urus crossover SUV.  The Urus shares much of its engineering with other Volkswagen Group models, including the Audi Q8 and the Bentley Bentayga. Lamborghini sold 8,300 vehicles last year, according to Volkswagen Group's annual report. Ducati is known for high-performance motorcycles, such as the 214-horsepower Panigale V4. It sells about 50,000 bikes a year worldwide.  Italdesign Giugiaro is a design and engineering consulting firm that was founded, in part, by famed Italian auto designer Giorgetto Giugiaro in 1968. Among many other cars, Giugiaro is known for his work on the DMC DeLorean and the original Volkswagen Golf. Under VW's current structure, Audi, Lamborghini and Ducati are grouped together as the Premium brand group, while Porsche, Bentley and Bugatti are the Sport and Luxury group. The Volkswagen car brand, along with SEAT, based in Spain, and Škoda, headquartered in the Czech Republic, are in VW's Volume brand group. Lamborghini, Bentley and Bugatti were all purchased separately by Volkswagen Group in 1998. "
22,https://www.cnn.com/2020/11/11/tech/robots-india-covid-spc-intl/index.html,Robots are joining the fight against coronavirus in India,"Bangalore-based Invento Robotics has designed three robots to carry out tasks ranging from disinfecting surfaces to answering patient questions and enabling video consultations with doctors.  Of the eight the company has so far deployed, the most popular model is Mitra, which means friend in Hindi and costs around $10,000. Using facial-recognition technology, the robot can recall the names and faces of patients it has interacted with. Mitra can roam around a hospital independently, helping patients connect with family and doctors via its cameras and a video screen attached to its chest. ""Mitra can be the nurse's or doctor's assistant, take readings and vitals, remind them of medications,"" says Balaji Viswanathan, CEO of Invento Robotics. He says the human-like robot engages with patients and gains their trust. ""It may sound ironic but we are using robots to bring humanity to hospitals,"" he tells CNN Business.  Yatharth Hospital in the city of Noida, northern India, has deployed two Mitra robots — one at its entrance to screen patients for coronavirus symptoms and the other in the intensive care unit. ""Inside our ICU [Mitra] helps patients connect with their families through video stream and gives the patient's family a look inside,"" hospital director Kapil Tyagi tells CNN Business.  ""Patients get happy and positive whenever the robot visits them. They are often clicking selfies with Mitra,"" he says.  Viswanathan says Invento uses ""best in class security"" for video feeds between doctors, patients and their families. For in-depth telemedicine consultations, a booth is built around the robot to give patients privacy. Coronavirus pivot Viswanathan and his wife Mahalakshmi Radhakrushnun moved to Bangalore in 2016 from Boston, USA, where Viswanathan was completing a PhD in human robot interaction and Radhakrushnan was working in manufacturing. They wanted to combine their experience to create robots that improved patient care in hospitals and care homes, but they struggled to find customers. So they started supplying banks, including India's HDFC (HDB) and Standard Chartered (SCBFF) in Qatar, with robots who could identify visitors, print passes and take customer feedback. ""Two years ago, there was not much interest on the healthcare side,"" says Viswanathan. ""When coronavirus hit, hospitals finally understood what we were talking about.""  India has had more than 8 million cases of coronavirus, and more than 120,000 deaths. Hospitals have struggled to cope, and Invento isn't the only robotics company that is helping out.  Milagrow Robotics specializes in home cleaning robots, but has deployed five humanoid cleaning robots to Indian hospitals during the pandemic, while Kerala-based Asimov Robotics has created a robot to dispense medicine and clean up after patients. Producing robots during the pandemic has been challenging, says Viswanathan.  When India went into lockdown in March, non-essential businesses closed and his company struggled to secure materials from suppliers. ""There was a three to four-month delay. Manufacturing was a huge headache,"" he adds. But his company is starting to deliver on its mission of improving patient care. ""That is where our heart is,"" Viswanathan says."
23,https://www.cnn.com/2020/11/18/media/barack-obama-book-first-day-sales/index.html,"Obama's highly anticipated book 'A Promised Land' sells 890,000 copies on its first day","It is a title previously bestowed on his wife, Michelle Obama, whose book ""Becoming"" rocketed to the top of the charts in 2018. Now the former president's new memoir, ""A Promised Land,"" is breaking records for the book's publisher, Crown, an imprint of Penguin Random House. Hundreds of thousands of people pre-ordered ""A Promised Land"" ahead of Tuesday's release date.  Those pre-order sales, plus first-day sales, totaled 887,000 units ""in all formats and editions in the U.S. and Canada,"" Penguin Random House said on Wednesday. The publisher said this result represented ""the largest first-day sales total for any book ever published"" by the company. Penguin and the rest of the publishing industry anticipated this moment: Obama's memoir, the first of two expected volumes, has been the talk of book world. For the United States and Canada, Crown printed 3.4 million copies of the hardcover edition.  Barnes & Noble CEO James Daunt told Publishers Weekly earlier in the year, ""This will be a book of rare consequence. That it will sell as no other book has done since July 21, 2007"" — when ""Harry Potter and the Deathly Hallows"" came out — ""is immensely cheering to booksellers."" One bookstore in Washington, D.C. even opened at midnight Tuesday morning to sell copies of ""A Promised Land."" Booksellers expect that the memoir will remain a top seller throughout the holiday season. "
