,url,title,body
8,https://www.cnn.com/2020/11/17/business/boeing-737-max-grounding-cost/index.html,Boeing's 737 Max debacle could be the most expensive corporate blunder ever,"The two fatal crashes that led to the grounding of the Boeing 737 Max killed 346 people.     Financially, Boeing continues to pay a hefty cost to ensure the safety of future 737 Max passengers. Direct costs Boeing has detailed about $20 billion in direct costs from the grounding: $8.6 billion in compensation to customers for having their planes grounded, $5 billion for unusual costs of production, and $6.3 billion for increased costs of the 737 Max program. The company also spent nearly $600 million for jet storage, pilot training and software updates that are not included in the company's overall cost estimate. It also established a $100 million victim compensation fund, which is also not included in Boeing's $20 billion in estimated costs.  So the costs of the grounding released by Boeing total $20.7 billion. Boeing's legal liability will almost certainly add to that cost. Published reports show that the families of the first 11 victims to settle with Boeing received at least $1.2 million each. That means the total cost is likely to top $500 million. Interest costs are adding up, too. Boeing borrowed billions of dollars at a roughly 5% interest rate to keep building 737 Max planes it can't deliver. The company built 450 Max jets during the grounding, but it hasn't delivered a single 737 Max plane in that nearly nearly two-year period.  Only about half will be delivered next year, and some deliveries will stretch as far as 2023. Boeing doesn't get most of the money from a sale until the plane is delivered to the airline, so the interest will pile up — perhaps by about $3 billion or $4 billion, said Chris Denicolo, aerospace credit analyst with Standard & Poor's.  What's clear is that the $20.7 billion in costs that Boeing has detailed is only the starting point. Bank of America puts the costs at more than $25 billion. ""It's going to be more than $20 billion. But it's hard to say how much more it's going to be,"" said Denicolo. Lost sales If financial damage from the 737 Max remains in the $20 billion range, that would not put it in the running for the most expensive mistake by a company. Volkswagen has spent €32 billion, or $38 billion, on its emissions cheating scandal. The most expensive mistake to date is the $68 billion cost to BP of the Deepwater Horizon explosion and oil spill of 2010. But BP lost little or no sales because of Deepwater Horizon, and VW suffered only a minor, short-term loss of sales from the emissions scandal. By contrast, it's clear that Boeing has suffered a huge loss in sales in the wake of the 737 Max grounding.  Because of the grounding, Boeing lost the cancellation fees that had been written into in its sales contracts for 737 Max orders. As the Covid-19 pandemic sent air travel demand plummeting, airlines have begun taking advantage of the free cancellation policy, anticipating they won't need new planes for several years. Boeing had disclosed 448 canceled orders for the Max so far this year, compared with only nine for its other models. In addition it has dropped another 782 orders from its backlog of 737 Max orders because it believes those orders are no longer certain enough to rely on. In at least some cases those uncertain plane orders are jets airline customers have said they no longer want. A 737 Max typically sells for about $55 million, or half of the stated list price, so the worst-case scenario for Boeing is that it could lose as much as $67 billion in revenue from the drop in sales.  But experts say it's more likely that Boeing will eventually sell those planes, though at a steep discount, in some cases to the same customers who are now canceling the orders. S&P's Denicolo and another industry expert agree that those steep discounts in sales price, which wouldn't have taken place if not for the grounding, are the real financial risk for Boeing.  ""Say you're an airline. If there's no longer any penalty, why not cancel all my orders, and I can buy them back much cheaper?"" said the industry expert, who spoke on the condition of anonymity.  Boeing will not comment on the prices paid for its planes or any discounts. But the expert said it might be as much as a $20 million discount per plane, or roughly $25 billion total — more than doubling the true cost of the grounding.  Discounting many of the 3,300 other Max orders still on the books could make Boeing's total cost of its 737 Max debacle climb even higher, perhaps past the $68 billion price tag of Deepwater Horizon."
9,https://www.cnn.com/2020/11/18/business/stock-market-election-trump-jpmorgan/index.html,JPMorgan lays out the nightmare election scenario that could send markets into a tailspin,"Michael Cembalest, chairman of market and investment strategy at JPMorgan Asset Management, warned in a report Wednesday of the ""remote risk of an American horror story"" and ""constitutional mayhem."" Cembalest, who helps oversee $2.2 trillion in assets, pointed to President Donald Trump's Tuesday night firing of the top US election security official, Attorney General William Barr's decision to authorize prosecutors to probe alleged voter fraud and the fleeting drama over certifying election results in Michigan's largest county. ""Bottom line: a LOT of very unorthodox things have to happen for Trump to be reelected,"" the JPMorgan strategist wrote. ""Even so, I'm not ruling anything out."" Post-election chaos would of course rattle markets, which famously hate uncertainty. The smoother-than-feared election set off a celebration on Wall Street, with the S&P 500 notching its biggest post-election rally since 1932.  But if investors don't know who's going to be in charge of the world's largest economy, they could easily sell first and ask questions later.  ""Markets might react negatively if the US as the world's reserve currency nation is seen as sliding down a path toward electoral illegitimacy due to post-election maneuvers by political parties,"" Cembalest wrote. 'Dueling inaugurations' To be sure, legal experts say Trump's long-shot bid at overturning the election is just that, a long-shot. Put simply, Trump is losing by too many votes in too many states.  As Cembalest notes, Trump would need to ""reverse or impede results in three states"" to prevent Joe Biden from reaching the 270 electoral votes required by the Constitution. And as CNN has reported, despite Trump's baseless claims (which Twitter has repeatedly flagged), there is no evidence of the widespread fraud required to overturn those results.  ""Relax. Biden will be sworn in on January 20,"" Ohio State constitutional election law expert Edward Foley wrote in a Washington Post op-ed last week, which was cited by Cembalest.  Even so, the JPMorgan strategist laid out several developments that could cast doubt on that outcome, including that one or more states submit competing slates of electors. Those competing slates would then be resolved January 6 by the new Congress through rules spelled out in the Electoral Count Act of 1887. ""The nightmare scenario for markets,"" according to Cembalest, would be if Senate Republicans declare the ECA unconstitutional, flip three states in Trump's favor to give him the required 270 electoral votes and Democrats refuse to participate.  ""All of which sets up the prospect of dueling inaugurations,"" Cembalest wrote, noting that this outcome was only ""narrowly averted"" in 1876. Another risk laid out by Cembalest is if Barr directs investigators to ""seize or impound election records"" to probe for voter fraud, slowing down the process.  Dimon: 'We have a new president' For the most part, investors have appeared to ignore Trump's war on the election results.  Markets have not flinched in response to headlines about his campaign's many lawsuits. If anything, Wall Street came to terms with the outcome of the election even before CNN and other media outlets projected Biden to be the winner.  Investors have largely focused on other matters, including the makeup of the US Senate, progress in the quest to develop a coronavirus vaccine to fight the worsening pandemic and the prospects for the economic recovery.  But some are beginning to raise concerns about a transfer of power.   ""I think we're making far too little of this,"" CNBC anchor Jim Cramer said Wednesday while expressing worries about a peaceful transition to a new administration.   Liz Ann Sonders, chief investment strategist at Charles Schwab, said that although her firm's experts don't see much of a risk of ""rogue"" electors, there ""could certainly still be some black swan political event."" Perhaps heeding the warnings of Cembalest, JPMorgan CEO Jamie Dimon has repeatedly urged Americans to respect the outcome of the election.  ""We need a peaceful transition. We had an election. We have a new president,"" Dimon said Wednesday during The New York Time's virtual DealBook conference. ""You should support that whether you like it or not,  because it's based on a system of faith and trust."""
10,https://www.cnn.com/2020/11/18/business/norwegian-air-bankruptcy-protection/index.html,Norwegian Air has filed for bankruptcy ,"The budget carrier said in a statement on Wednesday that it has decided to file for examinership in Ireland, which is where its aircraft assets are held. Examinership allows companies to seek a court's protection from creditors for up to 100 days, and is the rough equivalent of Chapter 11 bankruptcy in the United States. ""The purpose of the process is to reduce debt, rightsize the fleet and secure new capital,"" Norwegian Air said. The process is expected to take up to five months, it added. ""Seeking protection to reorganize under Irish law is a decision that we have taken to secure the future of Norwegian for the benefit of our employees, customers and investors,"" CEO Jacob Schram said. ""Our aim is to find solutions with our stakeholders that will allow us to emerge as a financially stronger and secure airline."" Norwegian Air was founded in 1993 and began a rapid expansion nearly a decade ago, seeking to apply the business model pioneered by Ryanair in Europe and Southwest in the United States to transatlantic flights. But the aggressive strategy left it with huge debts, and little room to maneuver when things went wrong. Norwegian Air said on Wednesday that it will continue to operate its route network, which has been severely limited as a result of the coronavirus, and its shares will trade as normal on the Oslo Stock Exchange. The stock has lost more than 98% of its value this year. The carrier warned last week that it would need additional cash to continue operating through the first quarter of next year and beyond. It received a state-backed loan of 3 billion Norwegian Krone ($288.7 million) in May, but the country's government has ruled out providing more financial assistance — a decision Schram described as ""a slap in the face."" The airline carried just 1 million passengers in the third quarter, compared to 10.5 million during the same period last year. Its quarterly operating loss amounted to 2.8 billion Krone ($310 million), while cash and cash equivalents had dwindled to just 3.4 billion Krone ($376 million) at the end of September. — Charles Riley contributed to this report."
11,https://www.cnn.com/2020/09/25/tech/giraffe-south-africa-unemployment-spc-intl/index.html,South Africa has the world's worst youth unemployment. This job-matching site wants to change that,"After months of being ignored by recruiters in her home country of South Africa, the economics graduate began using a recruitment website called Giraffe. Compared to the experience of being ""ghosted"" by other recruiters, Zondani says getting guidance every step of the way was like ""a breath of fresh air,"" and she eventually landed a job with an insurance company. Zondani knows she is one of the lucky ones in the current economic climate. South Africa was already in recession and struggling with record-high unemployment before the pandemic. In 2019, it had the world's highest youth unemployment rate, at 56%, and Covid-19 has led to even more job losses. But Giraffe believes it can help those hit the hardest: unskilled and less educated workers. Founded in 2015 by Anish Shivdasani and Shafin Anwarsha, Giraffe has automated the recruitment process, from sourcing candidates to screening them.  Where jobseekers would usually apply for positions on paper or in person, they can now upload their résumé to the online platform, and an algorithm will match them with relevant jobs.   Giraffe was built for mobile devices, which is how most South Africans primarily access the internet, explains Shivdasani. Smartphone penetration in the country has doubled from 2016 to 91% in 2019. Of those with internet access, around 60% use a mobile device. While other job portals and recruitment agencies often target high-skilled jobseekers, Shivdasani says Giraffe's focus is primarily on entry to mid-level jobs. ""We really target the mass segment of the market,"" Shivdasani tells CNN Business. ""We define it as salaries between 3,000 and 25,000 rand ($177 to $1,470) a month."" This income range represents about two-thirds of the total South African workforce, he adds. Shivdasani and Anwarsha met while working as strategy consultants in the telecoms industry. Shivdasani says he had always dreamed of building a platform to solve social problems in South Africa. In brainstorming where to start, he realized that unemployment was at the core of many of them. ""We felt that unemployment is probably the biggest problem in South Africa,"" he says. Giraffe is completely free for jobseekers, explains Shivdasani, and instead charges businesses to post jobs on its platform. It has worked with about 3,000 businesses and currently has one million jobseekers registered on its platform. Shivdasani estimates Giraffe reaches approximately 10 million jobseekers through partnerships with Facebook (FB) and Google (GOOG). Giraffe has even developed a voice note function that lets companies listen to applicants answering questions before inviting them to interview. ""It's a combination of matching, screening and voice clips, which sets us apart from other platforms,"" Shivdasani says.  This year the company received a grant from UNICEF, which it will use to build a content portal to arm jobseekers with career advice. Giraffe declined to disclose the amount of funding it received. South Africa's structural challenges   As South Africa slowly opens up from one of the world's strictest lockdowns, unemployment is spiking and inequality is widening. A recent UNDP report estimates it will take at least five years to recover to pre-coronavirus levels of economic growth and employment. Vimal Ranchhod, an economics professor at the University of Cape Town, says skills development with the help of platforms like Giraffe is one way to assist young people. However, he cautions that it will be hard to address structural challenges in the labor market or education, many of which are tied to the country's apartheid past. ""Given the scale and nature of the problem, it requires a large-scale and long-term intervention from the government,"" he says. ""This does not mean that individual groups should not help if and when they can, because every little bit can help."""
12,https://www.cnn.com/2020/11/18/business/kfc-restaurant-redesign/index.html,This is what the KFC of the future will look like,"The two new designs KFC revealed Wednesday highlight the fact that diners' habits have shifted toward delivery rather than in restaurant dining -- a trend that started pre-pandemic, but was accelerated by coronavirus, ""proving a need for a modernized design,"" the company said. The existing KFC store design, called the ""American Showman,"" will eventually be phased out in favor of one of the two new concepts. One design ditches the traditional dining room, an option with less square footage that would be ideal for expansion into busier areas like cities where real estate is more expensive. Chipotle and Starbucks recently debuted similar designs that are smaller than typical locations. KFC's other design emphasizes the drive-thru, which encompassed 60% of the company's sales in the third quarter. This design features two drive-thru lanes, with one dedicated to mobile order pickup. Taco Bell, which is also owned by Yum! Brands (YUM), showed off a similar idea earlier this year.  That option also includes an outdoor seating area called the ""Colonel's Porch"" and an interior dining room that's smaller than KFC's current layouts. Both concepts feature brighter branding that highlights KFC's classic red and white stripes and a brightly lit red bucket that directs customers to a newly installed ""cubby system"" for online and pickup orders.  Some restaurants will have dedicated parking spots for customers that order from KFC's app or third-party apps, as well as reserved spaces for DoorDash, Uber Eats and Postmates delivery drivers. KFC said the new designs will roll out in three US locations next year, including West Palm Beach, Indianapolis and central Kentucky.  The drive-thru has become even more important for quick serve restaurants during the pandemic, with multiple chains, including McDonald's and Chipotle, revealing in recent earnings calls that restaurants with them have seen sales increase faster. McDonald's, Burger King and Popeye's all have announced restaurant redesigns that enhance their drive-thrus. "
13,https://www.cnn.com/2020/11/06/tech/whatsapp-pay-india-intl-hnk/index.html,India is letting WhatsApp offer payments to millions more users,"Facebook (FB), which owns the popular messaging platform, announced Friday that it had gone live with the new feature after years of regulatory hurdles prevented it from making the service widely available in India.  The National Payments Corporation of India, an organization affiliated with the Reserve Bank of India, confirmed in a statement Thursday that it had given approval for WhatsApp to roll out the service to more people, starting with a user base of up to 20 million accounts.  The company had been testing the tool in India since 2018 with up to 1 million users. The country is WhatsApp's biggest market, with 400 million users.  ""I am excited today that WhatsApp has been approved to launch payments across India,"" CEO Mark Zuckerberg said in a video statement. ""Now you can send money to your friends and family through WhatsApp as easily as sending a message."" The feature is already available on the latest version of the app in 10 Indian languages. Facebook noted that anyone who wants to use the service needs to have a bank account and debit card with a lender that allows users to make transactions across different apps in India. WhatsApp has made no secret of its ambitions to start providing more services to users in India.  It first announced plans to move into online payments more than three years ago and in 2018, appointed the co-founder of a digital payments firm, Abhijit Bose, as its first India chief, signaling a desire to ramp up its plans in the space. Facebook's latest move also comes as the company is spending big money in India. In April, it pumped $5.7 billion into Jio Platforms, the tech firm run by Indian billionaire Mukesh Ambani. Jio Payments Bank, which operates under Ambani's Reliance Industries umbrella, is one of the partners on WhatsApp's new payments venture. — Rishi Iyengar contributed to this report."
14,https://www.cnn.com/2020/10/07/tech/india-smartphone-apple-intl-hnk/index.html,India offers Samsung and iPhone suppliers new incentives to boost local production,"The program includes 16 companies involved in making smartphones and components, including Samsung (SSNLF), Austria's AT&S and several Indian firms. Major Apple (AAPL) suppliers Foxconn, Wistron and Pegatron are participating as well — notable inclusions, given how much Apple has been pushing to grab a larger slice of one of the world's fastest growing smartphone markets. The companies have to increase their production of smartphones in the country to benefit, according to a Tuesday statement from India's Ministry of Electronics and Information and Technology. They will get incentives worth between 4% and 6% of the sales of certain products made in India over a period of 5 years. The incentive program is expected to bring 110 billion rupees ($1.5 billion) worth of investment to the country's electronics manufacturing industry, according to the government statement.  The government's decision to incentivize smartphone makers isn't a huge surprise. The industry has been booming in India, and is now worth about $230 billion, according to the India Cellular and Electronics Association.  China's Xiaomi tripled the number of smartphone plants it has in India on its way to top spot in the market, while global leader Samsung opened what it claims is the ""world's largest mobile factory"" near New Delhi in 2018. Apple began manufacturing some iPhones in Bangalore in 2017 and recently started domestic production of the iPhone 11. While the Indian government named the program's participants, it did not disclose how much each company is expected to invest. But Reuters reported, citing sources, that Foxconn, Wistron and Pegatron plan to invest nearly $900 million in the next five years to benefit from the incentives.  Foxconn, Wistron and Pegatron did not immediately respond to a request for comment. Foxconn chairman Liu Young-Way reportedly said at a shareholders meeting in June that the company was planning further investment in India. The Taiwanese firm already has a plant in India, where it manufactures smartphones for Apple and other clients.  Apple and Samsung ""together account for nearly 60% of global sales revenue of mobile phones,"" the Ministry of Electronics and Information and Technology said, adding that the program was expected to ""increase their manufacturing base manifold in the country."" Apple's ambitions For Apple, the nod from regulators for its suppliers could provide a tailwind for the company's India ambitions. Apple holds less than 2% of India's smartphone market, though has been trying to grow that amount and increase its presence in the country. The iPhone maker launched its online store in the country last month, and it also wants to open its first physical store there next year. Part of the problem is that many of the company's products are seen as prohibitively expensive for most Indians. Apple sets prices in different countries based in part on taxes and the local currency's strength against the dollar. The 64GB variant of the iPhone XR costs about $120 more in India than it does in the United States. Expanding local smartphone production would allow Apple to avoid India's heavy import taxes on iPhones, potentially making them cheaper for Indian customers. The government's new incentives could mean that ""more of the local India iPhones sales is catered by the locally produced iPhones, which would bring down the cost,"" said IDC senior research manager Kiranjeet Kaur. She noted that so far, iPhones made in India are older generation models, with new flagship phones still coming from China.  Apple is also expected to release its latest iPhone later this month, and Wedbush analyst Dan Ives said there is ""a spike in demand out of India.""   The ""region could translate into some surprising iPhone units upside as Apple heads into this key launch period,"" Ives wrote in a note on Wednesday.  — Rishi Iyengar contributed to this report."
